[
  {
    "is_synthetic": true,
    "id": "NTF-0001",
    "ticket_id": "WO-0002",
    "type": "first_response_overdue",
    "created_at": "2026-10-23T23:26:00Z",
    "recipient_team_id": "TEAM-NL-CLOUD",
    "status": "pending",
    "delivery_mode": "in_app_demo_only",
    "dedupe_key": "WO-0002:cycle-1:first_response_overdue"
  },
  {
    "is_synthetic": true,
    "id": "NTF-0002",
    "ticket_id": "WO-0007",
    "type": "resolution_target_overdue",
    "created_at": "2026-10-24T03:01:00Z",
    "recipient_team_id": "TEAM-FR-CLOUD",
    "status": "pending",
    "delivery_mode": "in_app_demo_only",
    "dedupe_key": "WO-0007:cycle-1:resolution_target_overdue"
  },
  {
    "is_synthetic": true,
    "id": "NTF-0003",
    "ticket_id": "WO-0008",
    "type": "first_response_overdue",
    "created_at": "2026-10-23T19:16:48Z",
    "recipient_team_id": "TEAM-IT-CLOUD",
    "status": "pending",
    "delivery_mode": "in_app_demo_only",
    "dedupe_key": "WO-0008:cycle-2:first_response_overdue"
  },
  {
    "is_synthetic": true,
    "id": "NTF-0004",
    "ticket_id": "WO-0010",
    "type": "first_response_overdue",
    "created_at": "2026-10-24T01:45:00Z",
    "recipient_team_id": "TEAM-NL-CLOUD",
    "status": "pending",
    "delivery_mode": "in_app_demo_only",
    "dedupe_key": "WO-0010:cycle-1:first_response_overdue"
  },
  {
    "is_synthetic": true,
    "id": "NTF-0005",
    "ticket_id": "WO-0011",
    "type": "first_response_overdue",
    "created_at": "2026-10-22T17:53:00Z",
    "recipient_team_id": "TEAM-NL-TECHNICAL",
    "status": "pending",
    "delivery_mode": "in_app_demo_only",
    "dedupe_key": "WO-0011:cycle-1:first_response_overdue"
  },
  {
    "is_synthetic": true,
    "id": "NTF-0006",
    "ticket_id": "WO-0011",
    "type": "resolution_target_overdue",
    "created_at": "2026-10-23T13:53:00Z",
    "recipient_team_id": "TEAM-NL-TECHNICAL",
    "status": "pending",
    "delivery_mode": "in_app_demo_only",
    "dedupe_key": "WO-0011:cycle-1:resolution_target_overdue"
  },
  {
    "is_synthetic": true,
    "id": "NTF-0007",
    "ticket_id": "WO-0012",
    "type": "resolution_target_overdue",
    "created_at": "2026-10-23T10:36:00Z",
    "recipient_team_id": "TEAM-ES-TECHNICAL",
    "status": "pending",
    "delivery_mode": "in_app_demo_only",
    "dedupe_key": "WO-0012:cycle-1:resolution_target_overdue"
  },
  {
    "is_synthetic": true,
    "id": "NTF-0008",
    "ticket_id": "WO-0013",
    "type": "resolution_target_overdue",
    "created_at": "2026-10-23T07:19:00Z",
    "recipient_team_id": "TEAM-GB-TECHNICAL",
    "status": "pending",
    "delivery_mode": "in_app_demo_only",
    "dedupe_key": "WO-0013:cycle-1:resolution_target_overdue"
  },
  {
    "is_synthetic": true,
    "id": "NTF-0009",
    "ticket_id": "WO-0016",
    "type": "resolution_target_overdue",
    "created_at": "2026-10-22T21:28:00Z",
    "recipient_team_id": "TEAM-FR-TECHNICAL",
    "status": "pending",
    "delivery_mode": "in_app_demo_only",
    "dedupe_key": "WO-0016:cycle-1:resolution_target_overdue"
  },
  {
    "is_synthetic": true,
    "id": "NTF-0010",
    "ticket_id": "WO-0017",
    "type": "first_response_overdue",
    "created_at": "2026-10-23T05:58:57Z",
    "recipient_team_id": "TEAM-IT-TECHNICAL",
    "status": "pending",
    "delivery_mode": "in_app_demo_only",
    "dedupe_key": "WO-0017:cycle-2:first_response_overdue"
  },
  {
    "is_synthetic": true,
    "id": "NTF-0011",
    "ticket_id": "WO-0017",
    "type": "resolution_target_overdue",
    "created_at": "2026-10-24T01:58:57Z",
    "recipient_team_id": "TEAM-IT-TECHNICAL",
    "status": "pending",
    "delivery_mode": "in_app_demo_only",
    "dedupe_key": "WO-0017:cycle-2:resolution_target_overdue"
  },
  {
    "is_synthetic": true,
    "id": "NTF-0012",
    "ticket_id": "WO-0019",
    "type": "resolution_target_overdue",
    "created_at": "2026-10-22T11:37:00Z",
    "recipient_team_id": "TEAM-NL-TECHNICAL",
    "status": "pending",
    "delivery_mode": "in_app_demo_only",
    "dedupe_key": "WO-0019:cycle-1:resolution_target_overdue"
  },
  {
    "is_synthetic": true,
    "id": "NTF-0013",
    "ticket_id": "WO-0020",
    "type": "first_response_overdue",
    "created_at": "2026-10-23T19:35:00Z",
    "recipient_team_id": "TEAM-ES-TECHNICAL",
    "status": "pending",
    "delivery_mode": "in_app_demo_only",
    "dedupe_key": "WO-0020:cycle-1:first_response_overdue"
  },
  {
    "is_synthetic": true,
    "id": "NTF-0014",
    "ticket_id": "WO-0021",
    "type": "resolution_target_overdue",
    "created_at": "2026-10-22T05:03:00Z",
    "recipient_team_id": "TEAM-ES-TECHNICAL",
    "status": "pending",
    "delivery_mode": "in_app_demo_only",
    "dedupe_key": "WO-0021:cycle-1:resolution_target_overdue"
  },
  {
    "is_synthetic": true,
    "id": "NTF-0015",
    "ticket_id": "WO-0022",
    "type": "resolution_target_overdue",
    "created_at": "2026-10-22T01:46:00Z",
    "recipient_team_id": "TEAM-GB-TECHNICAL",
    "status": "pending",
    "delivery_mode": "in_app_demo_only",
    "dedupe_key": "WO-0022:cycle-1:resolution_target_overdue"
  },
  {
    "is_synthetic": true,
    "id": "NTF-0016",
    "ticket_id": "WO-0025",
    "type": "resolution_target_overdue",
    "created_at": "2026-10-21T15:55:00Z",
    "recipient_team_id": "TEAM-FR-TECHNICAL",
    "status": "pending",
    "delivery_mode": "in_app_demo_only",
    "dedupe_key": "WO-0025:cycle-1:resolution_target_overdue"
  },
  {
    "is_synthetic": true,
    "id": "NTF-0017",
    "ticket_id": "WO-0026",
    "type": "first_response_overdue",
    "created_at": "2026-10-22T16:41:06Z",
    "recipient_team_id": "TEAM-IT-TECHNICAL",
    "status": "pending",
    "delivery_mode": "in_app_demo_only",
    "dedupe_key": "WO-0026:cycle-2:first_response_overdue"
  },
  {
    "is_synthetic": true,
    "id": "NTF-0018",
    "ticket_id": "WO-0026",
    "type": "resolution_target_overdue",
    "created_at": "2026-10-23T12:41:06Z",
    "recipient_team_id": "TEAM-IT-TECHNICAL",
    "status": "pending",
    "delivery_mode": "in_app_demo_only",
    "dedupe_key": "WO-0026:cycle-2:resolution_target_overdue"
  },
  {
    "is_synthetic": true,
    "id": "NTF-0019",
    "ticket_id": "WO-0028",
    "type": "resolution_target_overdue",
    "created_at": "2026-10-21T06:04:00Z",
    "recipient_team_id": "TEAM-NL-TECHNICAL",
    "status": "pending",
    "delivery_mode": "in_app_demo_only",
    "dedupe_key": "WO-0028:cycle-1:resolution_target_overdue"
  },
  {
    "is_synthetic": true,
    "id": "NTF-0020",
    "ticket_id": "WO-0029",
    "type": "first_response_overdue",
    "created_at": "2026-10-23T14:02:00Z",
    "recipient_team_id": "TEAM-ES-TECHNICAL",
    "status": "pending",
    "delivery_mode": "in_app_demo_only",
    "dedupe_key": "WO-0029:cycle-1:first_response_overdue"
  },
  {
    "is_synthetic": true,
    "id": "NTF-0021",
    "ticket_id": "WO-0030",
    "type": "first_response_overdue",
    "created_at": "2026-10-20T03:30:00Z",
    "recipient_team_id": "TEAM-GB-TECHNICAL",
    "status": "pending",
    "delivery_mode": "in_app_demo_only",
    "dedupe_key": "WO-0030:cycle-1:first_response_overdue"
  },
  {
    "is_synthetic": true,
    "id": "NTF-0022",
    "ticket_id": "WO-0030",
    "type": "resolution_target_overdue",
    "created_at": "2026-10-20T23:30:00Z",
    "recipient_team_id": "TEAM-GB-TECHNICAL",
    "status": "pending",
    "delivery_mode": "in_app_demo_only",
    "dedupe_key": "WO-0030:cycle-1:resolution_target_overdue"
  },
  {
    "is_synthetic": true,
    "id": "NTF-0023",
    "ticket_id": "WO-0031",
    "type": "resolution_target_overdue",
    "created_at": "2026-10-22T20:13:00Z",
    "recipient_team_id": "TEAM-GB-CLOUD",
    "status": "pending",
    "delivery_mode": "in_app_demo_only",
    "dedupe_key": "WO-0031:cycle-1:resolution_target_overdue"
  },
  {
    "is_synthetic": true,
    "id": "NTF-0024",
    "ticket_id": "WO-0034",
    "type": "resolution_target_overdue",
    "created_at": "2026-10-22T10:22:00Z",
    "recipient_team_id": "TEAM-FR-CLOUD",
    "status": "pending",
    "delivery_mode": "in_app_demo_only",
    "dedupe_key": "WO-0034:cycle-1:resolution_target_overdue"
  },
  {
    "is_synthetic": true,
    "id": "NTF-0025",
    "ticket_id": "WO-0035",
    "type": "first_response_overdue",
    "created_at": "2026-10-22T23:23:15Z",
    "recipient_team_id": "TEAM-IT-CLOUD",
    "status": "pending",
    "delivery_mode": "in_app_demo_only",
    "dedupe_key": "WO-0035:cycle-2:first_response_overdue"
  },
  {
    "is_synthetic": true,
    "id": "NTF-0026",
    "ticket_id": "WO-0038",
    "type": "first_response_overdue",
    "created_at": "2026-10-19T21:14:00Z",
    "recipient_team_id": "TEAM-ES-CLOUD",
    "status": "pending",
    "delivery_mode": "in_app_demo_only",
    "dedupe_key": "WO-0038:cycle-1:first_response_overdue"
  },
  {
    "is_synthetic": true,
    "id": "NTF-0027",
    "ticket_id": "WO-0038",
    "type": "resolution_target_overdue",
    "created_at": "2026-10-21T21:14:00Z",
    "recipient_team_id": "TEAM-ES-CLOUD",
    "status": "pending",
    "delivery_mode": "in_app_demo_only",
    "dedupe_key": "WO-0038:cycle-1:resolution_target_overdue"
  },
  {
    "is_synthetic": true,
    "id": "NTF-0028",
    "ticket_id": "WO-0039",
    "type": "resolution_target_overdue",
    "created_at": "2026-10-21T17:57:00Z",
    "recipient_team_id": "TEAM-GB-CLOUD",
    "status": "pending",
    "delivery_mode": "in_app_demo_only",
    "dedupe_key": "WO-0039:cycle-1:resolution_target_overdue"
  },
  {
    "is_synthetic": true,
    "id": "NTF-0029",
    "ticket_id": "WO-0040",
    "type": "resolution_target_overdue",
    "created_at": "2026-10-21T14:40:00Z",
    "recipient_team_id": "TEAM-AU-CLOUD",
    "status": "pending",
    "delivery_mode": "in_app_demo_only",
    "dedupe_key": "WO-0040:cycle-1:resolution_target_overdue"
  },
  {
    "is_synthetic": true,
    "id": "NTF-0030",
    "ticket_id": "WO-0043",
    "type": "resolution_target_overdue",
    "created_at": "2026-10-18T08:49:00Z",